0,1
Critical  analysis  of previous  empirical  studies,209
be significantly  altered. Instead of an ahistorical concept such as the eco-,
"nomic  surplus,  we need concepts  of  the  surplus product  specific  to  each",
mode of production under study. Surplus value is just such a concept  for,
the capitalist  mode of  production.66,
,66  A  concrete  social  formation  will generally  encompass  some  noncapitalist  activi-
,"ties.  Their  products,  and  any  surplus  products,  must  be  addressed  separately,"
,even  if  in the end they  interact  with  or enter  into the circuit  of  capital  (see Sec-
